{
  "formatVersion": 1,
  "targetBranch": "codex/v4-development-base",
  "requiredContexts": ["v4-contract", "v4-linux", "v4-package", "v4-required"],
  "permissions": { "contents": "read" },
  "allowedChangedPatterns": [".gitattributes", ".gitignore", "README.md", "plugin.json", "build/**", "core/**", "docs/**", "integrations/**", "modules/**", "profiles/**", "tests/**"],
  "windowsSensitivePatterns": [
    "build/**",
    "core/certification/**",
    "core/distribution/**",
    "core/host/**",
    "core/runtime/**",
    "integrations/**",
    "modules/build-evidence-provider/**",
    "tests/p2/**",
    "tests/p3/**",
    "tests/p4/Test-V4BuildEvidence.ps1",
    "tests/p6/**",
    "tests/p7/**",
    "tests/p8/**",
    "tests/p9/**"
  ],
  "approvedTests": [
    { "path": "tests/p0/Test-V4Contracts.ps1", "sha256": "dc1bada0eaf8103b43f94a378a6333a13e080b4c2f31d4a861d6d39eebd6aada", "linux": true, "windowsSmoke": true, "windowsFull": true },
    { "path": "tests/p0/Test-V4GenesisProposal.ps1", "sha256": "6350f8027a21adc6b6e8a7f138c5069aab577ab0050131ccea0323cb7fa6c8b4", "linux": true, "windowsSmoke": false, "windowsFull": true },
    { "path": "tests/p0/Test-V4HostSpike.ps1", "sha256": "2da49d7dd99e4be783ddfacfdd7b45126e2d0d67103c59d254de6cb544a1733d", "linux": true, "windowsSmoke": false, "windowsFull": true },
    { "path": "tests/p1/Test-V4Package.ps1", "sha256": "60aad8f109388d100008e6f782e80ab65e870da67c77ffa571fcf70a4ebfc7e2", "linux": true, "windowsSmoke": true, "windowsFull": true },
    { "path": "tests/p1/Test-V4Registry.ps1", "sha256": "e8edde022cf36d9c1edcde5389d54a7c85dd038adae13f839df8fc3d4d81dd42", "linux": true, "windowsSmoke": false, "windowsFull": true },
    { "path": "tests/p2/Test-V4Reset.ps1", "sha256": "1e467b2866422b33a4491e5d8f6abd0f7c1c180c9c1d36078962d00a269bc8e0", "linux": true, "windowsSmoke": true, "windowsFull": true },
    { "path": "tests/p2/Test-V4StateTransactions.ps1", "sha256": "26c833e3d965f6f4ae421866b51b8b0603adff7af12438dacae135e6680a2fac", "linux": true, "windowsSmoke": false, "windowsFull": true },
    { "path": "tests/p3/Test-V4StageOrchestration.ps1", "sha256": "56f7a366b53674561e88a2c74396a72800d55d178fb08b0a9b944c0a85c690e4", "linux": true, "windowsSmoke": true, "windowsFull": true },
    { "path": "tests/p3/Test-V4Stages.ps1", "sha256": "0a48886e8cde98158ace1026e08c5f6d204283ce01c8edba5ebddc15121012a4", "linux": true, "windowsSmoke": false, "windowsFull": true },
    { "path": "tests/p4/Test-V4ArchitectureAuthority.ps1", "sha256": "7f65b78d475f51bf78e154fab0be560e978ce2a4d2e352412a3c0595684a8d6a", "linux": true, "windowsSmoke": false, "windowsFull": true },
    { "path": "tests/p4/Test-V4ArchUnitNetAdapter.ps1", "sha256": "0aba044f541088ee039b9dcae0f6e333a5f19c9b7ebcd8f771508316360c3246", "linux": true, "windowsSmoke": false, "windowsFull": true },
    { "path": "tests/p4/Test-V4BuildEvidence.ps1", "sha256": "33f045eba754154848a6d6c7a17b25170ab41ecaf96fb242cf9580822f46af38", "linux": true, "windowsSmoke": true, "windowsFull": true },
    { "path": "tests/p4/Test-V4CompositeArchitecture.ps1", "sha256": "4cefa0f7417b1428e5dfd0b48314682a16c3401fd284fdd70717100797e62ef5", "linux": true, "windowsSmoke": false, "windowsFull": true },
    { "path": "tests/p4/Test-V4ProjectModel.ps1", "sha256": "7ed79b66fe8fd1d970627dc901b7db824e00a71d65f01afca33a09a6fc87cac0", "linux": true, "windowsSmoke": false, "windowsFull": true },
    { "path": "tests/p4/Test-V4RoslynDetectors.ps1", "sha256": "84159b49e0c82b22e80e7e89abb7de82393cd370494abc44abaa67875bfcfb19", "linux": true, "windowsSmoke": false, "windowsFull": true },
    { "path": "tests/p4/Test-V4TargetScope.ps1", "sha256": "4d58e3bc2e2729eb4159e43cf9a7d3ba4eccef2fbb1d571b1014efbfc08d02b2", "linux": true, "windowsSmoke": false, "windowsFull": true },
    { "path": "tests/p5/Test-V4PlanDiff.ps1", "sha256": "476bfaea9498338d29d380ef487a7a7dd1938998ca9348a09086494f4b0aba5a", "linux": true, "windowsSmoke": false, "windowsFull": true },
    { "path": "tests/p5/Test-V4PlanRuntime.ps1", "sha256": "f732534a912c5dde5767a5b4446a6e09b994ef124fb32b81963c89c708bde0b0", "linux": true, "windowsSmoke": true, "windowsFull": true },
    { "path": "tests/p6/Test-V4ChangeClassifier.ps1", "sha256": "03bc7f59df52825a6853264458ec9a49b5421ba3f2303b87ae7690e3b0a9d8d0", "linux": true, "windowsSmoke": true, "windowsFull": true },
    { "path": "tests/p6/Test-V4TrustedBase.ps1", "sha256": "872da519136ac24f1c5179f770395b7c3741e096e7b0e8c31e82a99034e46f66", "linux": false, "windowsSmoke": false, "windowsFull": true },
    { "path": "tests/p6/Test-V4WorkflowContract.ps1", "sha256": "f7d682ac2a58f1f407ead0a72904327f30aac06f91c906a4aa71e1e026e33d8e", "linux": true, "windowsSmoke": true, "windowsFull": true },
    { "path": "tests/p7/Test-V4Distribution.ps1", "sha256": "9a6e362a74b8850b56eed6ba03501315e7622d6408dd775e0d2118fda6df617f", "linux": true, "windowsSmoke": true, "windowsFull": true },
    { "path": "tests/p7/Test-V4Documentation.ps1", "sha256": "bcd7d2ae66f8df3dc22093194412a351e00fc16eb3ba6fb61cf70851e2999014", "linux": true, "windowsSmoke": false, "windowsFull": true },
    { "path": "tests/p7/Test-V4Lifecycle.ps1", "sha256": "aae3119ced801f7b4e2347ed64abd65c0fce189391eee78413fd82bb8e75956b", "linux": true, "windowsSmoke": true, "windowsFull": true },
    { "path": "tests/p8/Test-V4CandidateCertification.ps1", "sha256": "d4da736516c1d349e38b567db04195b921816018536c93e1b3e84958c92675b5", "linux": true, "windowsSmoke": true, "windowsFull": true },
    { "path": "tests/p8/Test-V4CompatibilityBaseline.ps1", "sha256": "db05553cc2e4ca703d6c8be4315c210d33f771f74ead0b34ee160518692ee847", "linux": true, "windowsSmoke": true, "windowsFull": true },
    { "path": "tests/p8/Test-V4SupplyChain.ps1", "sha256": "dd7de895c8327b04cf5db3acb3f6684e227ef9af328bc29f1a7455f13c14a644", "linux": true, "windowsSmoke": true, "windowsFull": true },
    { "path": "tests/p8/Test-V4V1Acceptance.ps1", "sha256": "7568f1b1267b18f0a9c1d5f3ad41b96a1db166122726810acab023a03d250608", "linux": true, "windowsSmoke": true, "windowsFull": true },
    { "path": "tests/p8/Test-V4StableCli.ps1", "sha256": "2aa239d0d39b8da59afd225fdd5fc9c07e742405bcc137f3395dc8c8a8f1778a", "linux": true, "windowsSmoke": true, "windowsFull": true },
    { "path": "tests/p9/Test-V4EvidencePlanCenter.ps1", "sha256": "97ea8d1c8c9d7052a6db67640089d4feaf6a13f03f0772f14bd294dce991fbd6", "linux": true, "windowsSmoke": false, "windowsFull": true },
    { "path": "tests/p9/Test-V4OfflineWebDistribution.ps1", "sha256": "bb8de79f9ab371a438818175083cf70bf77cfbc2ac907c921f5ba66b67dc8ecb", "linux": true, "windowsSmoke": true, "windowsFull": true },
    { "path": "tests/p9/Test-V4QueryContracts.ps1", "sha256": "b4f8a1d2ef78c462b33e4bda3545eb156210127c78c9a6b7d2a79c07d8c81218", "linux": true, "windowsSmoke": false, "windowsFull": true },
    { "path": "tests/p9/Test-V4WebCompanionSpike.ps1", "sha256": "9097219b3260d0bb4ba8863db79d291c058189b01440eb4e4a7683570708c82a", "linux": true, "windowsSmoke": false, "windowsFull": true },
    { "path": "tests/p9/Test-V4WorkspaceStageRunner.ps1", "sha256": "e96bfc4f9715e5b0ee882b5c9fb9da5d7b7850800e396b1f9687ce7040abf62f", "linux": true, "windowsSmoke": false, "windowsFull": true },
    { "path": "tests/p10/Test-V4ExtensionComposition.ps1", "sha256": "3d375365c1fa12b6213dbe741fe6a87bb977f6aec2b31ab90a48ef13ab4c6500", "linux": true, "windowsSmoke": false, "windowsFull": true },
    { "path": "tests/p10/Test-V4M2M5Focused.ps1", "sha256": "5653de3334deb8af953d64bcdeed8c6355178d934a33acb214d57455bc805baa", "linux": true, "windowsSmoke": false, "windowsFull": true }
  ],
  "artifact": { "name": "v4-ci-artifact", "manifestPath": "manifest.json", "packagePath": "package", "hostPath": "host/v4-guards.dll" },
  "excludedSuites": ["ifx-solution", "ifx-frontend", "ifx-database", "v3-package-candidate"]
}
